{
  "schema_version": "1.0.0",
  "verdict": "pass",
  "reason": "",
  "run": "examples/runs/qe-skerry-live/out/natural/iterations/001/matrix-20261009T225542Z",
  "baseline": "examples/runs/qe-skerry-live/out/control/iterations/001/matrix-20261009T224714Z",
  "evaluation_type": "skill_behaviour",
  "pass_threshold": 0.7,
  "max_regression": 0.0,
  "combos_compared": [
    "claude-sonnet-5__qe-skill-iii__skerry-frame-testing"
  ],
  "quarantined_cases": [],
  "unmatched_cases": [],
  "judge": {
    "participates": false,
    "agreement": null,
    "agreement_min": 0.7,
    "calibrated": true
  },
  "signals": [
    {
      "evaluator_id": "catches_most_defects",
      "kind": "assertion",
      "slot": "task_outcome",
      "baseline_mean": 0.6666666666666666,
      "candidate_mean": 1.0,
      "delta": 0.33333333333333337,
      "baseline_n": 3,
      "candidate_n": 3,
      "baseline_errors": 0,
      "candidate_errors": 0,
      "guarded": false,
      "regressed": false
    },
    {
      "evaluator_id": "left_the_code_under_test_alone",
      "kind": "assertion",
      "slot": "trace_conformance",
      "baseline_mean": 1.0,
      "candidate_mean": 1.0,
      "delta": 0.0,
      "baseline_n": 3,
      "candidate_n": 3,
      "baseline_errors": 0,
      "candidate_errors": 0,
      "guarded": false,
      "regressed": false
    },
    {
      "evaluator_id": "mutation_kill_rate",
      "kind": "assertion",
      "slot": "task_outcome",
      "baseline_mean": 0.8218954248366014,
      "candidate_mean": 0.7859477124183006,
      "delta": -0.03594771241830075,
      "baseline_n": 3,
      "candidate_n": 3,
      "baseline_errors": 0,
      "candidate_errors": 0,
      "guarded": false,
      "regressed": true
    },
    {
      "evaluator_id": "no_vacuous_assertions",
      "kind": "assertion",
      "slot": "task_outcome",
      "baseline_mean": 1.0,
      "candidate_mean": 1.0,
      "delta": 0.0,
      "baseline_n": 3,
      "candidate_n": 3,
      "baseline_errors": 0,
      "candidate_errors": 0,
      "guarded": false,
      "regressed": false
    },
    {
      "evaluator_id": "qe_assertion_strength",
      "kind": "assertion",
      "slot": null,
      "baseline_mean": 0.9450377980228727,
      "candidate_mean": 0.9368279569892474,
      "delta": -0.00820984103362532,
      "baseline_n": 3,
      "candidate_n": 3,
      "baseline_errors": 0,
      "candidate_errors": 0,
      "guarded": false,
      "regressed": true
    },
    {
      "evaluator_id": "qe_changed_line_coverage",
      "kind": "assertion",
      "slot": null,
      "baseline_mean": 0.9917695473251028,
      "candidate_mean": 0.9547325102880658,
      "delta": -0.03703703703703698,
      "baseline_n": 3,
      "candidate_n": 3,
      "baseline_errors": 0,
      "candidate_errors": 0,
      "guarded": false,
      "regressed": true
    },
    {
      "evaluator_id": "qe_flake_resistance",
      "kind": "assertion",
      "slot": null,
      "baseline_mean": 1.0,
      "candidate_mean": 1.0,
      "delta": 0.0,
      "baseline_n": 3,
      "candidate_n": 3,
      "baseline_errors": 0,
      "candidate_errors": 0,
      "guarded": true,
      "regressed": false
    },
    {
      "evaluator_id": "qe_no_tautological_assertions",
      "kind": "assertion",
      "slot": null,
      "baseline_mean": 0.9940476190476191,
      "candidate_mean": 0.9914529914529915,
      "delta": -0.0025946275946275854,
      "baseline_n": 3,
      "candidate_n": 3,
      "baseline_errors": 0,
      "candidate_errors": 0,
      "guarded": false,
      "regressed": true
    },
    {
      "evaluator_id": "qe_rubric",
      "kind": "assertion",
      "slot": "task_outcome",
      "baseline_mean": 0.9801493464615354,
      "candidate_mean": 0.9661860889011425,
      "delta": -0.01396325756039285,
      "baseline_n": 3,
      "candidate_n": 3,
      "baseline_errors": 0,
      "candidate_errors": 0,
      "guarded": false,
      "regressed": true
    },
    {
      "evaluator_id": "read_before_writing_tests",
      "kind": "assertion",
      "slot": "trace_conformance",
      "baseline_mean": 1.0,
      "candidate_mean": 1.0,
      "delta": 0.0,
      "baseline_n": 3,
      "candidate_n": 3,
      "baseline_errors": 0,
      "candidate_errors": 0,
      "guarded": false,
      "regressed": false
    },
    {
      "evaluator_id": "seeded_defects_caught",
      "kind": "assertion",
      "slot": "task_outcome",
      "baseline_mean": 0.3333333333333333,
      "candidate_mean": 1.0,
      "delta": 0.6666666666666667,
      "baseline_n": 3,
      "candidate_n": 3,
      "baseline_errors": 0,
      "candidate_errors": 0,
      "guarded": true,
      "regressed": false
    },
    {
      "evaluator_id": "suite_is_stable",
      "kind": "assertion",
      "slot": "task_outcome",
      "baseline_mean": 1.0,
      "candidate_mean": 1.0,
      "delta": 0.0,
      "baseline_n": 3,
      "candidate_n": 3,
      "baseline_errors": 0,
      "candidate_errors": 0,
      "guarded": false,
      "regressed": false
    }
  ],
  "guarded_regressions": [],
  "recorded": "2026-10-09",
  "stats": {
    "mean_delta": 0.14445103926083758,
    "ci_low": 0.03229443859618164,
    "ci_high": 0.2554126841363789,
    "confidence": 0.95,
    "significant_regression": false,
    "significant_improvement": true,
    "newly_failing_hard_gates": [],
    "buckets": {
      "working": 2,
      "fixed": 1,
      "regression": 0,
      "still_gap": 0
    },
    "n_cases": 3,
    "n_quarantined": 0
  }
}
